{
  "contract_version": "1.0.0",
  "schema_version": "coinfox_coordination_packet.v0",
  "packet_type": "ActionReceipt",
  "packet_id": "coord-action-receipt-001",
  "packet_hash": "sha256:fixture-action-receipt-valid",
  "correlation_id": "coord-demo-001",
  "sequence": 3,
  "created_at": "2026-07-01T16:02:00Z",
  "source_system": "foxclaw",
  "target_system": "coinfox",
  "previous_packet_hash": "sha256:fixture-decision-ack-valid",
  "classification": {
    "data_classification": "public_safe_coordination",
    "public_safe": true,
    "private_evidence_exported": false,
    "paper_only": true,
    "no_trading": true,
    "no_custody": true,
    "not_financial_advice": true,
    "not_real_lending": true
  },
  "authority_requested": ["draft_only"],
  "authority_granted": ["draft_only"],
  "action_receipt": {
    "action_status": "executed",
    "action_taken": "exported_sanitized_cards",
    "matched_intent": true,
    "summary": "FoxClaw exported sanitized draft cards for CoinFox review only.",
    "artifact_refs": [
      "coinfox-draft-card-demo-001"
    ],
    "block_reason": ""
  }
}
