{
  "contract_version": "1.0.0",
  "schema_version": "coinfox_coordination_packet.v0",
  "packet_type": "IntentPacket",
  "packet_id": "coord-intent-blocked-001",
  "packet_hash": "sha256:fixture-intent-blocked",
  "correlation_id": "coord-demo-blocked-001",
  "sequence": 1,
  "created_at": "2026-07-01T16:00:00Z",
  "source_system": "foxclaw",
  "target_system": "coinfox",
  "previous_packet_hash": null,
  "classification": {
    "data_classification": "public_safe_coordination",
    "public_safe": true,
    "private_evidence_exported": false,
    "paper_only": true,
    "no_trading": true,
    "no_custody": true,
    "not_financial_advice": true,
    "not_real_lending": true
  },
  "authority_requested": ["auto_publish"],
  "authority_granted": [],
  "intent": {
    "requested_action": "auto_publish",
    "why_now": "This fixture records a blocked attempt to bypass CoinFox review.",
    "expected_output": "no_action",
    "public_safe_summary": "Auto-publishing is intentionally schema-recordable but semantically blocked.",
    "public_receipt_refs": [
      "tests/fixtures/public_contract/coinfox_curated_packet.valid.json"
    ],
    "private_evidence_refs": [],
    "expires_at": "2026-07-01T18:00:00Z",
    "risk_flags": [
      "auto_publish_requested",
      "must_block"
    ]
  }
}
