{
  "contract_version": "1.0.0",
  "schema_version": "coinfox_coordination_packet.v0",
  "packet_type": "IntentPacket",
  "packet_id": "coord-intent-001",
  "packet_hash": "sha256:fixture-intent-valid",
  "correlation_id": "coord-demo-001",
  "sequence": 1,
  "created_at": "2026-07-01T16:00:00Z",
  "source_system": "foxclaw",
  "target_system": "coinfox",
  "previous_packet_hash": null,
  "classification": {
    "data_classification": "public_safe_coordination",
    "public_safe": true,
    "private_evidence_exported": false,
    "paper_only": true,
    "no_trading": true,
    "no_custody": true,
    "not_financial_advice": true,
    "not_real_lending": true
  },
  "authority_requested": ["draft_only"],
  "authority_granted": [],
  "intent": {
    "requested_action": "prepare_draft_cards",
    "why_now": "FoxClaw has public-safe market pulse candidates ready for draft review.",
    "expected_output": "draft_cards",
    "public_safe_summary": "Prepare draft-only CoinFox cards from sanitized public packet candidates.",
    "public_receipt_refs": [
      "tests/fixtures/public_contract/coinfox_curated_packet.valid.json"
    ],
    "private_evidence_refs": [],
    "expires_at": "2026-07-01T18:00:00Z",
    "risk_flags": [
      "no_auto_publish",
      "public_safe_only"
    ]
  }
}
